{
  "feature_id": "fixture-detail",
  "feature": {
    "title": "매치 디테일 페이지 — 헤더 + 3패널 (Sofascore 참조)",
    "requirements_doc": "docs/features/fixture-detail.md"
  },
  "phase": "mock",
  "state": "FE_DONE_AWAITING_BE",
  "owner": "team-lead",
  "iteration": {
    "plan_review_loop": 0,
    "playwright_loop": 0,
    "review_loop": 0,
    "integration_loop": 0
  },
  "endpoint_requests": [
    "GET__api_v1_fixtures__id",
    "GET__api_v1_fixtures__id__events",
    "GET__api_v1_fixtures__id__lineups",
    "GET__api_v1_fixtures__id__h2h",
    "GET__api_v1_fixtures__id__statistics",
    "GET__api_v1_fixtures__id__league_standings",
    "frontend/endpoint-requests/GET__api_v1_fixtures__id.request.json",
    "frontend/endpoint-requests/GET__api_v1_fixtures__id__events.request.json",
    "frontend/endpoint-requests/GET__api_v1_fixtures__id__lineups.request.json",
    "frontend/endpoint-requests/GET__api_v1_fixtures__id__h2h.request.json",
    "frontend/endpoint-requests/GET__api_v1_fixtures__id__statistics.request.json",
    "frontend/endpoint-requests/GET__api_v1_fixtures__id__league_standings.request.json"
  ],
  "be_dependency_state": {
    "GET__api_v1_fixtures__id": "SPEC_REVIEW",
    "GET__api_v1_fixtures__id__events": "SPEC_REVIEW",
    "GET__api_v1_fixtures__id__lineups": "SPEC_REVIEW",
    "GET__api_v1_fixtures__id__h2h": "SPEC_REVIEW",
    "GET__api_v1_fixtures__id__statistics": "SPEC_REVIEW",
    "GET__api_v1_fixtures__id__league_standings": "SPEC_REVIEW"
  },
  "artifacts": {
    "spec_path": "docs/features/fixture-detail.spec.md",
    "devplan_path": "docs/features/fixture-detail.devplan.md",
    "testplan_path": "docs/features/fixture-detail.testplan.md",
    "branch": "fe-feat-fixture-detail",
    "commit": "f6d3651",
    "playwright_e2e_paths": []
  },
  "evidence": {
    "playwright_mock_log": "/tmp/fixture-detail-playwright.log",
    "test_verdict": "PASS",
    "review_artifact": ".codex/state/feature-flow/fixture-detail.review.json",
    "be_dependency_refreshed_at": "2026-05-24"
  },
  "gates": {
    "plan_approved_by": "team-lead (fe-reviewer 미응답 — lead 직접 검토. F01~F06+ 시나리오, league 동적 테마 §2.X 반영. APPROVE)",
    "review_approved_by": "fe-reviewer",
    "merge_approved_by": "team-lead"
  },
  "blockers": [],
  "next_action": {
    "agent": "team-lead",
    "command": "mock lifecycle complete"
  },
  "current_stage": "FE_DONE_AWAITING_BE",
  "tasklist_id": "17"
}
